{
  "schemaVersion": "0",
  "eventId": "00000000-0000-4000-8000-000000000002",
  "eventType": "synthetic.tool.completed",
  "occurredAt": "2026-01-15T09:30:00Z",
  "idempotencyKey": "synthetic-collector:00000000-0000-4000-8000-000000000002",
  "collector": {
    "name": "synthetic-collector",
    "version": "0.0.0"
  },
  "policyVersion": "0.0.0",
  "attributes": {
    "toolCategory": "synthetic-category",
    "outcome": "success",
    "durationMs": 85
  }
}
